7230556	I don't think that I snore.	12210880	Pensi pas que ronqui.
7782552	Tom lives in an old house.	12210885	Tom viu dins un vièlh ostal.
6259176	Tom has been gone for three years.	12210886	Fa tres ans que Tom partiguèt.
2257563	Tom will sing.	12210888	Tom cantarà.
10635336	Tom said that I didn't look drunk.	12210891	Tom diguèt que semblavi pas bandat.
5346227	You have to fill out this form.	12210892	Deves garnir aqueste formulari.
5346227	You have to fill out this form.	12210894	Deves emplenar aqueste formulari.
9668104	Please stop messaging me.	12210900	Arrèsta de l'escriure se te plai.
4468677	Sad.	12221456	Triste.
4468677	Sad.	12221457	Trist.
316541	She looked sad.	12221458	Semblava trista.
1024528	Tom looks sad.	12221460	Tom sembla trist.
4873681	A deep sadness overcame me.	12221480	Una prigonda tristesa m'envasiguèt.
5754864	I felt Tom's sadness.	12221491	Ai sentit la tristesa de Tom.
6365943	Don't be so sad.	12221492	Siás pas tan trist.
6662066	Tom said he was sad.	12221494	Tom diguèt qu'èra trist.
6759633	I'm very sad tonight.	12221496	Soi plan triste aqueste ser.
6759633	I'm very sad tonight.	12221497	Soi plan trista aqueste ser.
6784027	I know Tom is sad.	12221499	Sabi que Tom es trist.
6873255	I'm very sad today.	12221500	Soi plan trist uèi.
7382212	Mary said she was sad.	12221528	Mary diguèt qu'èra trista.
7405883	He said he was sad.	12221529	Diguèt qu'èra trist.
7405884	She said she was sad.	12221530	Diguèt qu'èra trista.
7783568	You're making me sad.	12221532	Me fas venir trist.
7783568	You're making me sad.	12221535	Me rendes trist.
7879129	He is a sad boy.	12221670	Es un dròlle trist.
8097614	Why are you sad now?	12221674	Perqué siás trist ara ?
8097614	Why are you sad now?	12221675	Perqué siás trista ara ?
8174350	I'm not sad now.	12221677	Ara soi pas trist.
8174350	I'm not sad now.	12221678	Ara soi pas trista.
8357804	Tom brought us sad news.	12221680	Tom nos portèt de tristas novèlas.
1434324	The socks stink.	12223955	Mas caucetas pudisson.
7538424	Tom bought socks.	12223956	Tom crompèt de caucetas.
11132272	I wear socks.	12223957	Pòrti de caucetas.
50756	Take off your socks.	12223946	Tira tas caucetas.
437148	I wash my socks.	12223958	Lavi mas caucetas.
694406	The letter returned.	12223961	La letra tornèt.
7356188	Read the letter.	12223969	Legís la letra.
9401975	I write letters.	12223970	Escrivi de letras.
56547	Mail this letter.	12223972	Envia aquesta letra.
9231124	Read these letters.	12223973	Legís aquestas letras.
46755	Who wrote the letter?	12223974	Qual escriguèt la letra ?
46755	Who wrote the letter?	12223975	Qui escriguèt la letra ?
64424	I received your letter.	12223976	Ai recebut ta letra.
254474	I remember the letter.	12223977	Me remembri de la letra.
258457	I wrote a letter.	12223978	Escriguèri una letra.
415439	He wrote a letter.	12223962	Escriguèt una letra.
452751	He wrote one letter.	12223962	Escriguèt una letra.
519696	What is this letter?	12223979	Quala es aquela letra ?
524271	She wrote one letter.	12223962	Escriguèt una letra.
1033250	I write a letter.	12223959	Escrivi una letra.
1572976	He writes a letter.	12223964	Escriu una letra.
1660858	Tom is writing letters.	12223980	Tom es a escriure letras.
1759935	Is this a letter?	12223981	Es aquò una letra.
1761831	Is this your letter?	12223982	Es aquò ta letra ?
7193865	I'm waiting for somebody to help me.	12224259	Espèri que qualqu'un m'ajude.
2859495	They will hide it.	12224261	O amagaràn.
2859495	They will hide it.	12224263	O rescondràn.
6245629	You should come to visit us in Boston.	12224267	Nos deuriás venir veire a Boston.
6521887	I'll do what Tom and Mary say.	12224270	Farai çò que Tom e Mary dison.
6521887	I'll do what Tom and Mary say.	12224272	Farai çò que Tom e Mary digan.
1098314	We are at the boulevard St. Michel.	12224837	Sèm al baloard San Miquèl.
10085490	Hey, Michael here.	12224856	Òu, Miquèl aquí.
11592202	Michael planned it.	12224858	Miquèl o planifiquèt.
11594149	Michael thanked everyone.	12224861	Miquèl mercegèt tot lo monde.
3259539	His name is Michael.	12224850	Son nom es Miquèl.
11590515	Michael retold the story.	12224882	Miquèl tornèt contar l'istòria.
12205590	I'm George.	12224903	Soi Jòrdi.
52950	George married my sister.	12224906	Jòrdi maridèt ma sòrre.
7871511	Do you read mangas?	12224929	Legisses de mangas ?
8264237	Tom read a manga.	12224932	Tom legís un manga.
8925431	Tom reads mangas in Japanese.	12224946	Tom legís de mangas en japonés.
10038976	Do you know this manga?	12224948	Coneisses aqueste manga ?
10123887	My username is "Naruto".	12224964	Mon nom d'utilizaire es "Naruto".
1098092	Butter is soft.	12226020	Lo burre es doç.
8312697	I have butter.	12226021	Ai de burre.
8413164	I buy butter.	12226022	Crompi de burre.
10904883	Use butter moderately.	12226026	Utilizatz lo burre amb moderacion.
1841526	Where's the butter?	12226028	Ont es lo burre ?
11892177	I need flour.	12226152	Me cal de farina.
12065343	It's flour.	12226153	Es de farina.
34927	Bread is made from flour.	12226154	Lo pan es fach amb de farina.
10164896	Do you like ginger?	12226228	T'agrada lo gengibre ?
2630357	This is a ginger drink.	12226230	Es una beguda al gengibre.
8979512	My charger is broken.	12226730	Mon cargador es copat.
8999646	My charger stopped working.	12226732	Mon cargador daissèt de foncionar.
8999646	My charger stopped working.	12226733	Mon cargador quitèt de foncionar.
9359244	Is this your charger?	12226734	Es ton cargador ?
11158551	This is a charger.	12226736	Aquò es un cargador.
6936783	Did you bring your charger?	12226738	As aportat ton cargador ?
11852713	I plugged in the charger.	12226740	Branquèri lo cargador.
10706611	I've lost my phone charger.	12226725	Ai perdut mon cargador de telefòn.
6659366	Tom died from food poisoning.	12226997	Tom moriguèt d'una intoxicacion alimentària.
268765	Have you ever had food poisoning?	12227000	Avètz ja agut una intoxicacion alimentària ?
6511395	Tom and Mary probably have food poisoning.	12227007	Tom e Mary an probablament una intoxicacion alimentària.
8372406	I like anise liqueur.	12227256	M'agrada la liquor d'anís.
12224603	You can buy anise tea at the pharmacy.	12227258	Podetz crompar de tè a l'anís a la farmacia.
282101	Fever indicates sickness.	12227266	La fèbre indica una malautiá.
10026782	Yanni has fever.	12227267	Yanni a de fèbre.
282102	I have a fever.	12227268	Ai de fèbre.
282112	I have no fever.	12227271	Ai pas cap de fèbre.
1236592	Seems I have fever.	12227274	Sembla qu'ai de fèbre.
2111666	I'm wounded.	12227276	Soi ferit.
2203590	Tom is wounded.	12227277	Tom es ferit.
2203591	You're wounded.	12227278	Siás ferit.
6575236	Bandage the wound.	12227281	Sonhar la plaga.
263894	Time heals all wounds.	12227282	Lo temps suènha totas las plagas.
449033	His wound was bleeding.	12227284	Sa plaga sagnava.
806931	The wound became infected.	12227287	La plaga s'infectèt.
1263593	Wounds heal, scars remain.	12227291	Las plagan se suènhan, las cicatrises demòran.
1263593	Wounds heal, scars remain.	12227292	Las plagan se suènhan, las cretas demòran.
4650522	Who farted?	12227305	Qui a petat ?
4650522	Who farted?	12227309	Qui a lofat ?
6113352	A fart can relax.	12227315	Un pet pòt calmar.
8804332	It was a silent fart.	12227319	Èra un pet silenciós.
6113954	Recycle it.	12227633	Reciclatz-lo.
953208	Do you recycle?	12227642	Reciclas ?
6466725	Is this recyclable?	12227645	Es reciclable ?
5927333	You have to recycle.	12227647	Te cal reciclar.
4538910	I have a plastic cup.	12227659	Ai un gòt de plastic.
8392026	This is a plastic cup.	12227663	Aquò's un gòt de plastic.
2998754	The hot coffee can melt a plastic cup.	12227667	Lo cafè caud pòt far fondre un gòt de plastic.
11739740	I don't like drinking out of plastic cups.	12227669	M'agrada pas de beure dins un gòt de plastic.
7966270	This is a bracelet.	12227690	Aquò es un braçalet.
8926119	I love your bracelet.	12227691	Aimi ton braçalet.
9361757	Where's my bracelet?	12227693	Ont es mon braçalet ?
1730016	Tom has a medical bracelet.	12227698	Tom a un braçalet medical.
11010806	Hey open the door.	12227700	Òu dobrís la pòrta.
2147545	Where is she?	12177890	Ont es ?
10510721	I have a big cock.	12227703	Ai una gròssa quequeta.
11502192	I believe in you!	12227709	Cresi en tu !
4950733	Tom tried to help us.	12227714	Tom ensagèt de nos ajudar.
265658	It is in the way.	12227715	Es pel camin.
11904830	It's very cozy here.	12227722	Es plan confortable aquí.
2540345	Tom's not as bad as you say he is.	12227729	Tom es pas tan marrit coma dises qu'es.
5071279	People can be really weird.	12227732	Lo monde pòt èsser plan estranh.
11713307	I am not scared of dogs.	12227884	Ai pas paur dels cans.
11713307	I am not scared of dogs.	12227888	Ai pas paur dels gosses.
2261999	I will inform Tom.	12227897	Avisarai Tom.
2670844	Tom died because of me.	12227900	Tom moriguèt a causa de ieu.
703077	This is new.	12227925	Aquò's nòu.
426273	Is that clear?	12227929	Es clar ?
11445665	He worked with me.	12227934	Trabalhèt amb ieu.
8580944	I keep forgetting their names.	12230872	Teni d'oblidar lor nom.
280509	What's your specialty?	12230875	Quina es ta especialitat ?
12064126	I know that odor.	12230877	Coneissi aquesta odor.
3906457	You should talk to her now.	12230879	Deuriás li parlar ara.
2891960	That would be logical.	12230884	Seriá logic.
8866581	We're eating bread.	12230886	Manjam de pan.
3914080	I kissed him.	12230888	L'ai potonejat.
3733021	That seems weird to me.	12230889	Me sembla estranh.
11501754	The intestine is very long.	12236421	L'intestin es plan long.
7239451	Tom was a little disheartened.	12238363	Tom èra un pauc malcorat.
7239451	Tom was a little disheartened.	12238366	Tom èra un pauc descoratjat.
4704216	What's for dinner tonight?	12238379	Qué i a per sopar aqueste ser ?
11503300	David doesn't have neighbors.	12238386	David a pas de vesins.
12189164	We can talk here.	12248368	Podèm parlar aquí.
5388162	Criticizing is easier than doing.	12250208	Criticar es mai facil que far.
8290295	I hope you're in a safe place.	12250213	Espèri que siás en seguretat.
11903365	There is no one else like you.	12250217	I a pas degun coma tu.
3616268	Trees are alive.	12250229	Los arbres son vius.
9506116	Life is meaningless without you.	12250237	La vida sens tu a pas cap de sens.
10444696	I bought a new hat yesterday.	12250240	Crompèri un capèl novèl ièr.
6297848	Why do boys fight?	12252166	Perqué los dròlles se baton ?
11833196	Ivan can help.	12252167	Ivan pòt ajudar.
6044881	In addition to English, he knows German and French.	12252168	Amai de l'anglés, i sap en alemand e francés.
7241104	I don't want you to pay for it.	12252172	Vòli pas que pagues per aquò.
4500105	They know I know.	12252173	Sabon que sabi.
12055866	She thinks about you all the time.	12252174	Pensa a tu tot lo temps.
1840412	There are some mistakes in your translation.	12252175	I a de fautas dins ta traduccion.
5529413	This is just a game.	12252176	Es pas qu'un jòc.
5529413	This is just a game.	12252177	Es solament un jòc.
5529413	This is just a game.	12252178	Es sonque un jòc.
6089451	Stop! You're not allowed to park here.	12254086	Arrestatz ! Avètz pas lo drech de vos pagar aquí.
10367219	Our new TV cost us an arm and a leg.	12254129	Nòstra nòva television nos costèt los uèlhs del cap.
2376057	I know it's here somewhere.	12254130	Sabi qu'es per aquí.
6687310	I should've told Tom I loved him.	12254131	Auriái degut dire a Tom que l'aimavi.
17453	You are wanted on the phone.	12254132	Te vòlon al telefòn.
10204262	Ziri saw that.	12254133	Ziri vegèt aquò.
34242	Mr Brown is a doctor.	12254134	En Brown es doctor.
2478444	My mom says I'm pretty.	12254135	Ma maire ditz que soi polit.
2478444	My mom says I'm pretty.	12254136	Ma maire ditz que soi polida.
7303663	Eat more, Tom.	12254137	Manja mai, Tom.
6583746	Bonus points!	12254328	Ponches bònus !
5758354	Tom got a bonus.	12254336	Tom obtenguèt un bònus.
7653915	We all got a Christmas bonus.	12254342	Obtenguèrem totes un bònus de Nadal.
9373484	Three Kings' Day is celebrated on January 6th.	12256213	La fèsta dels Reis Magues es lo 6 de genièr.
9194548	Kids in Spain don't receive their gifts on Christmas Day, but on Three Kings' Day.	12256220	Los enfants en Espanha recebon pas lors presents lo jorn de Nadal mas lo jorn dels Reis Magues.
1586529	There was once a king who had three daughters.	12256224	Un còp èra un rei qu'aviá doas filhas.
1583465	Once upon a time lived a king who had three daughters.	12175686	Un còp èra un rei qu'aviá tres filhas.
259872	I am pregnant.	12256294	Soi embarrassada.
259872	I am pregnant.	12256295	Soi emprenhada.
348596	I'm pregnant.	12256294	Soi embarrassada.
348596	I'm pregnant.	12256295	Soi emprenhada.
1442058	She's pregnant.	12256275	Es emprenhada.
1442058	She's pregnant.	12256274	Es embarrassada.
1522327	Mary is pregnant.	12256306	Mary es emprenhada.
1522327	Mary is pregnant.	12256308	Mary es embarrassada.
6979828	Is "super caloric" a Spanish word?	12257045	Es "super caloric" un mot espanhòl ?
6712668	Carbonated beverages oftentimes have a high caloric content.	12257052	Las bevendas refrescantas an sovent un fòrt contengut caloric.
11546364	It's important to monitor one's caloric intake.	12257054	Es important de susvelhar sos pròpris apòrts calorics.
704681	The only way to lose weight is to create a caloric deficit by burning more calories than you eat.	12257059	La sola manièra de pèrdre de pes es de crear un deficit caloric en cremant mai de calorics que ne manjas.
10326252	What does Tom want to talk to me about?	12260662	De qué me vòl parlar Tom ?
8762378	Scales measure weight.	12262179	Las balanças mesuran lo pes.
8762376	A scale measures weight.	12262184	Una balança mesura lo pes.
6627619	Tom stepped on the scale.	12262187	Tom montèt sus la balança.
325186	She's depressed.	12262507	Es deprimida.
304594	He is depressed.	12262503	Es deprimit.
1299395	I'm depressed.	12262504	Soi deprimit.
514675	He's depressed.	12262503	Es deprimit.
876458	She was depressed.	12262512	Èra deprimida.
1093972	Tom got depressed.	12262513	Tom venguèt deprimit.
1095807	Tom became depressed.	12262513	Tom venguèt deprimit.
1867767	Tom was depressed.	12262514	Tom èra deprimit.
2202750	We're depressed.	12262509	Sèm deprimits.
2237224	Tom looks depressed.	12262515	Tom sembla deprimit.
2237671	Tom seemed depressed.	12262516	Tom semblava deprimit.
2264735	Black is depressing.	12262517	Lo negre es depriment.
3374167	That depresses me.	12262518	Aquò me deprimís.
6150336	In the interim, please send all communications to Tom.	12262520	Entre temps, mercés d'enviar totas las comunicacions a Tom.
775204	The water is lukewarm.	12263365	L'aiga es tebesa.
3719561	The water was lukewarm.	12263366	L'aiga èra tebesa.
800917	The coffee is only lukewarm.	12263368	Lo cafè es sonque tebés.
800917	The coffee is only lukewarm.	12263370	Lo cafè es sonque mièg caud.
9799337	The bathwater is only lukewarm.	12263374	L'aiga del banh es sonque tebesa.
6665343	I don't like lukewarm coffee.	12263375	M'agrada pas lo cafè tebés.
6665343	I don't like lukewarm coffee.	12263376	M'agrada pas lo cafè mièg caud.
10792374	This was routine.	12263425	Èra la rotina.
4496442	The routine has changed.	12263430	La rotina a cambiat.
6550160	It's a routine procedure.	12263432	Es una procedura rotina.
7367535	This workout routine is brutal.	12263434	Aquesta rotina d’entraïnament es brutala.
7979877	What's your morning routine?	12263435	Quala es ta rotina matinièra ?
5657254	I've changed my daily routine.	12263438	Ai cambiat ma rotina quotidiana.
5657254	I've changed my daily routine.	12263442	Ai cambiat ma rotina jornadièra.
10023339	Yanni has a daily routine.	12263445	Yanni a una rotina jornadièra.
10023339	Yanni has a daily routine.	12263446	Yanni a una rotina quotidiana.
2852215	Is that your daily routine now?	12263447	Quala es ta rotina quotidiana ara ?
2852215	Is that your daily routine now?	12263450	Quala es ta rotina jornadièra ara ?
261835	I speak English daily.	12263454	Parli anglés cada jorn.
307568	They need daily care.	12263456	Lor cal de suènhs jornadièrs.
307568	They need daily care.	12263458	Lor cal de suènhs quotidians.
27367	What's the daily rate?	12263462	Quina es la tarifa quotidiana ?
27367	What's the daily rate?	12263464	Quina es la tarifa jornadièra ?
2896368	What is his daily goal?	12263467	Quin es son objectiu jornadièr ?
2896368	What is his daily goal?	12263468	Quin es son objectiu quotidian ?
3689341	I love my daily life.	12263469	Aimi mon quotidian.
8979542	I charge my phone daily.	12263471	Cargui mon telefòn cada jorn.
681437	Mathematics is important in daily life.	12263472	Las matematicas son importantas per la vida de cada jorn.
5850099	That is one of my daily duties.	12263484	Aquò es un de mos deguts quotidians.
5850099	That is one of my daily duties.	12263486	Aquò es un de mos deguts jornadièrs.
9963309	Are these rutabagas?	12263505	Son de rutabagas ?
9550191	The rutabaga is delicious!	12263506	Lo rutabaga es deliciós !
263981	Time is the most precious thing of all.	12263543	Lo temps es la causa mai preciosa de tot.
6810557	Sami studied psychiatry.	12263831	Sami estudièt psiquiatrica.
9838020	Tom studied psychiatry.	12263832	Tom estudièt psiquiatrica
10736114	Tom teaches psychiatry.	12263833	Tom ensenha psiquiatrica.
10225790	Ziri specialized in psychiatry.	12263835	Ziri s'especializèt en psiquiatrica.
1875818	He was sent to a mental hospital.	12263839	Lo menèron a un espital psiquiatric.
1875820	She was sent to a mental hospital.	12263840	La menèron a un espital psiquiatric.
3724587	Tom was sent to a mental hospital.	12263841	Menèron Tom a un espital psiquiatric.
1418629	Call the manager.	12263862	Sonatz lo gestionari.
2107678	We'll manage.	12263863	I arribarem.
2215706	Tom will manage.	12263864	Tom se'n cargarà.
10878845	Manage your emotions.	12263865	Gerís tas emocions.
291976	He managed to escape.	12263866	Capitèrem de nos escapar.
4733253	I hate celery!	12264347	Detèsti l'api !
8821479	I like celery.	12264353	M'agrada l'api.
6587064	I love cabbage!	12264360	M'agrada lo caul.
6587064	I love cabbage!	12264361	Aimi lo caul.
7075945	I like leeks.	12264376	M'agradan los pòrres.
3070761	I do believe it's called a leek.	12264378	Cresi que qu'apèla un pòrre.
954003	Is eating raw pumpkin safe?	12264390	Es segur de manjar de cojas crusas ?
2818965	My pumpkin was the best.	12264391	Ma coja èra la melhora.
7954295	Believe that I understand your distaste.	12264455	Crei que compreni ton fàstic.
7954295	Believe that I understand your distaste.	12264456	Crei que compreni ton desgost.
753372	It disgusts me.	12264458	Me fa fàstic.
753372	It disgusts me.	12264459	Me desgosta.
753372	It disgusts me.	12264462	Aquò me ven en òdi.
753372	It disgusts me.	12264463	Me fastiga.
1868050	Tom looks disgusted.	12264464	Tom sembla desgostat.
1868050	Tom looks disgusted.	12264465	Tom sembla afastigat.
1895776	You disgust me.	12264466	Me fas fàstic.
1895776	You disgust me.	12264467	M'afastigas.
1895776	You disgust me.	12264468	Me desgostas.
2190744	Tom is disgusting.	12264469	Tom es desgostant.
2190744	Tom is disgusting.	12264470	Tom es fastigós.
5930431	He disgusts me.	12264459	Me desgosta.
5930431	He disgusts me.	12264458	Me fa fàstic.
5930432	She disgusts me.	12264458	Me fa fàstic.
5930432	She disgusts me.	12264459	Me desgosta.
4300763	This pizza is disgusting!	12264472	Aquesta pizza es desgostanta.
4300763	This pizza is disgusting!	12264473	Aquesta pizza es fastigosa.
5360477	Wool is warm.	12267290	La lana es cauda.
6990822	Wool prices are falling.	12267453	Lo pres de la lana baissa.
34763	Sheep provide us with wool.	12267456	Los motons nos fornisson de lana.
388606	She was dressed in wool.	12267459	Èra vestida de lana.
9366806	I’ve put the salad bowl in the refrigerator.	12270604	Ai mes lo saladièr al refregidor.
9366806	I’ve put the salad bowl in the refrigerator.	12270607	Ai mes l'ensaladièr al refregidor.
33666	We have no salad in the bowl.	12270613	Avèm pas cap de salada dins lo bòl.
3965653	Ivan is beardless.	12271176	Ivan es imbèrbe.
5758143	Tom is beardless.	12271175	Tom es imbèrbe.
9132011	We're biologists.	12271192	Sèm biologistas.
4178683	His eyes are like sapphires.	12272955	Sos uèlhs son coma de safirs.
2844254	His belly as of ivory, set with sapphires.	12272959	Son ventre coma d'evòri recobèrt de safirs.
8800533	You aren’t able to conceal the mystery, are you?	12272969	Siás pas capable de gardar lo mistèri, non ?
6043751	Layla won awards.	12274725	Lay la ganhèt un prèmi.
5924736	I won an award.	12274726	Ai ganhèt un prèmi.
5924736	I won an award.	12274727	Ganhèri un prèmi.
5924737	He won an award.	12274728	Ganhèt un prèmi.
5924737	He won an award.	12274729	A ganhat un prèmi.
5924738	She won an award.	12274728	Ganhèt un prèmi.
5924738	She won an award.	12274729	A ganhat un prèmi.
8964886	Tom has won several awards.	12274730	Tom ganhèt mantun prèmi.
1681410	The award should be for me!	12274731	Lo prèmi deuriá èsser per ieu !
9409724	I think Tom deserves the award.	12274733	Pensi que Tom merita lo prèmi.
1165632	You deserve it.	12274734	O meritas.
1493323	He deserved it.	12274735	O a plan ganhat.
1690602	She deserved it.	12274735	O a plan ganhat.
1690605	You deserved it.	12274736	O as plan ganhat.
1690606	I deserved it.	12274738	O ai plan ganhat.
1690607	They deserved it.	12274739	O an plan ganhat.
2029954	I deserve more.	12274740	Ne meriti mai.
2029956	You deserve more.	12274741	Ne meritas mai.
2236197	Tom deserved better.	12274742	Tom meritava melhor.
8788789	The barrel is full.	12276798	La barrica es plena.
11231724	The barrels were empty.	12276800	Las barricas son voidas.
10082684	He hid in a barrel.	12276802	S'amaguèt dins una barrica.
12051275	Get out of the barrel.	12276803	Sortís de la barrica.
6108164	Do you have hepatitis?	12281089	As una epatiti ?
5734288	We're checking for hepatitis.	12281091	Verificam las epatitis.
5948224	It's a fungus.	12281934	Es una micòsi.
70359	Your name was dropped from the list.	12281955	Ton nom foguèt tirat de la lista.
70359	Your name was dropped from the list.	12281956	Ton nom foguèt levat de la lista.
1345547	Be careful not to fall.	12286434	Agachatz de tombar.
2733023	Be careful not to slip!	12286436	Agachatz de lisar !
2733023	Be careful not to slip!	12286438	Agachatz de limpar !
2623398	Be careful not to fall asleep.	12286440	Agachatz de vos endormir.
2733126	Be careful not to burn yourself.	12286444	Agachatz de vos cremar.
2978637	Be careful not to cut yourself.	12286445	Agachatz de vos copar.
3610580	Be careful not to hurt yourself.	12286446	Agachatz de vos nafrar.
3825836	Be careful not to get caught.	12286447	Agachatz de vos far atrapar.
4666282	Be careful not to be late.	12286448	Agachatz d'èsser tardièr.
5127228	Be careful not to be deceived.	12286449	Agachatz d'èsser decebut.
8988387	Be careful not to drop it.	12286451	Agachatz de lo tombar.
9816922	Be careful not to break that.	12286452	Agachatz de copar aquò.
473593	Be careful not to catch a cold.	12286497	Agachatz d'atrapar un reumàs.
473593	Be careful not to catch a cold.	12286498	Agachatz d'atrapar un raumàs.
1346605	Be careful not to break these eggs.	12286528	Agacha de copar aquestes uòus.
2047701	Just be careful not to break this.	12286529	Agacha de copar aquò.
2047709	Please be careful not to touch Tom.	12286530	Agacha de tocar lo Tom.
2092166	Be careful not to miss the train.	12286531	Agacha de mancar lo tren.
1566863	Pollen can cause anaphylactic shock when inhaled.	12287295	Lo pollèn pòt causar un còp anafilactic quand es inalat.
1774911	We visited the hippodrome. We visited the horse racecourse.	12287653	Avèm visitat l'ipodròm. Avèm visitat las pistas de corsa dels cavals.
6892777	Tom went to the racetrack.	12287654	Tom anèt a l'ipodròm.
4237867	This is a public street, not a racetrack.	12287655	Es una carrièra publica, non pas un l'ipodròm.
3910381	I can see them.	12293341	Los pòdi veire.
310487	She is always busy.	12293342	Es totjorn ocupada.
12266975	Nurses look after patients.	12294092	Los infirmièrs s'ocupa dels pacients.
7449068	We were stupid.	12294093	Èrem nècis.
8092954	I will begin anew.	12294094	Començarai tornamai.
8092954	I will begin anew.	12294096	Començarai de nòu.
434390	Can I talk to my doctor?	12294101	Pòdi parlar a mon mètge ?
8804403	That man is reading the newspaper.	12294107	Aquel òme es a legir lo jornal.
9980617	Like love and music, chess has the gift of making people happy.	12294109	Coma l'amor e la musica, lo fromatge a lo poder de far venir lo monde uroses.
3916964	I don't work for him.	12294111	Trabalhi pas per el.
8354037	I don't understand the way he thinks.	12294112	Compreni pas son biais de pensar.
10151416	Why don't we meet up for a drink later?	12294116	Perqué pas se veire per beure un còp aprèp ?
7485869	I've learned to ignore the pain.	12294121	Aprenguèri a ignorar la dolor.
1341215	He's a weird guy.	12294123	Es un estranh òme.
3737994	How can I cancel my wedding?	12294126	Cossí pòdi anullar mon maridatge ?
6259721	You're the one I want to meet.	12294127	Siás la persona que vòli veire.
8758581	They were far away.	12294129	Èran luènh.
7391923	She worked all her life.	12294136	Trabalhèt tota sa vida.
9795563	The girl did nothing she said.	12294138	La dròlla faguèt pas res de çò que diguèt.
2060035	I have a lot to learn.	12294139	Me demòra un molon de causas d'aprendre.
3915436	We can help them now.	12294368	Los podèm ajudar ara.
6099792	Don't you want anything to eat?	12294370	Vòles pas res per manjar ?
8554770	Ask yourself that question.	12294371	Pausa-te la question.
3003338	This isn't my dog.	12294372	Aquò es pas mon can.
10830355	They bragged.	12294374	Fanfarronegèron.
1205627	I want to tell you the story.	12294376	Te vòli contar l'istòria.
