6337839	Everyone knows Tom can't do that.	12709246	Totòm sap que Tom pòt pas far aquò.
46703	The practice is peculiar to Japan.	12709252	La practica es estranha al Japon.
12225147	Christmas is a time for togetherness.	12709254	Nadal es un moment de convivéncia.
4890378	I don't personally know Tom.	12709255	Coneissi pas personalament Tom.
6302304	Sami was known to have money.	12709258	Sami èra conegut per aver d'argent.
6302304	Sami was known to have money.	12709259	Sami èra conegut per aver de sòus.
8526268	He's quiet, isn't he?	12709268	Es silenciós, non ?
7380858	Mary has asked us to help her.	12709269	Mary nos demandèt de l'ajudar.
5848430	I've been hiccupping all afternoon.	12709448	Ai agut lo sanglot tota l'aprèp-miègjorn.
10568398	How many times have you met Tom?	12709449	Quantes de còps as vist Tom ?
6774581	I've been hiccuping all morning.	12709456	Ai agut lo sanglot tota la matinada.
8088517	I'm from Rio.	12709459	Soi de Rio.
8442589	I didn't enjoy the concert.	12709460	Lo concèrt m'a pas agradat.
10675880	There's not a soul here.	12358229	I a pas arma.
8923131	I need to put on weight.	12709484	Ai mestièr de metre de ventre.
8971283	Do you want to put on weight?	12709485	Vòls metre de ventre ?
12249991	I'm trying to put on weight.	12709486	Ensagi de metre de ventre.
6156317	Tom had to put on weight for the role.	12709487	Tom aguèt besonh de metre de ventre pel ròtle.
11816241	The sofa is for the living room.	12709982	Lo canapè es pel salon.
11816241	The sofa is for the living room.	12709983	Lo sofà es pel salon.
5780384	I'm learning Modern Greek.	12709986	Apreni lo grèc modèrne.
12068813	Nowadays, everybody does that.	12710005	Al temps que sèm, tot lo monde fa aquò.
12068813	Nowadays, everybody does that.	12710006	A l'ora d'ara, tot lo monde fa aquò.
7196622	I was surprised that Tom didn't come yesterday.	12710007	Èri espantat que Tom venguèt pas ièr.
7196622	I was surprised that Tom didn't come yesterday.	12710008	Èri espantada que Tom venguèt pas ièr.
3909941	When can we see him?	12710009	Quora lo podèm veire ?
8181704	This large tree provides shade.	12710010	Aqueste grand arbre fa d'ombra.
1476586	You must continue to train.	12710070	Deves téner de t'entraïnar.
8510499	It's up to us to ask.	12710073	Depend de nosautres de demandar.
12047141	You must respect the rules.	12710076	Deves respectar las règlas.
2237440	Tom never comes.	12710077	Tom ven pas jamai.
9713812	Here's a question for you.	12710079	Vaquí una question per tu.
5189381	I'm used to waiting.	12710109	Soi acostumat a esperar.
10140607	I miss you when you aren't here.	12710198	Me macas quand siás pas aquí.
10140607	I miss you when you aren't here.	12710199	Me macas quand siás pas aicí.
1331062	I like horses.	12710215	M'agradan los cavals.
7172916	I thought that Tom was on vacation.	12710218	Pensavi que Tom èra en vacanças.
3930791	A police helicopter located Dan's car.	12710342	Un elicoptèr de la polícia localizèt la veitura de Dan.
7910288	Police!	12710343	Polícia !
10708296	Fuck the police.	12710349	Bica la polícia.
10052655	Yanni was adopted.	12710356	Yanni es adoptat.
11813593	Tom gave Mary her money back.	12710357	Tom tornèt son argent a Mary.
5230898	I wouldn't want to work with Tom.	12710358	Volriái pas trabalhar amb Tom.
17941	It is because you are lazy that you cannot write your report.	12710363	Es perqué siás canhós que pòdes pas escriure ton rapòrt.
11568108	I can't be arsed.	12185028	Ai la canha.
12116839	The feckless liberals did nothing to stop fascism from taking over.	12710426	Los liberals ineficaces faguèron pas res per empachar lo fascisme de prendre lo poder.
7226403	I don't think that we can take that risk.	12230907	Cresi que podèm pas córrer aqueste risc.
12310613	This bilingual glossary contains thousands of terms.	12710456	Aqueste glossari bilingüe conten de milièrs de tèrmes.
58100	This line represents the longitude.	12711812	Aquesta linha representa la longitud.
3201656	Tell me when you want me to come.	12712032	Diga-me quand vòls que venga.
2549339	I'll take it now.	12712036	O prendrai ara.
11922322	What's just happened here?	12712123	Qué ven de se passar aquí ?
11856872	Here's the meaning of the sentence.	12712212	Vaquí la significacion de la frasa.
5263633	I was eating some strawberries.	12712393	Manjavi de fragostas.
5263633	I was eating some strawberries.	12712395	Manjavi d'ajordius.
2107496	Tom's drunk.	12176314	Tom es bandat.
5315421	I wish you a beautiful weekend!	12712398	Te desiri un polida dimenjada.
5291765	Tom lives only an hour away.	12712401	Tom viu sonque a una ora d'aquí.
35273	Passport, please.	12712412	Passapòrt, se vos plai.
2854383	Your passport, please.	12712413	Vòstre passapòrt, se vos plai.
35271	I have my passport.	12712414	Ai mon passapòrt.
436777	I lost my passport!	12712415	Ai perdut mon passapòrt !
905887	I have a passport.	12712416	Ai un passapòrt.
1852499	Show me your passport.	12712417	Mòstra-me ton passapòrt.
274268	The Prime Minister has resigned.	12712506	Lo primièr ministre demissionèt.
1141182	Tom speaks French fluently.	12713589	Tom parla francés amb fluiditat.
8187964	This is one of the weak points of public key cryptography.	12713686	Aquò es un dels ponches febles de la criptografia de la clau publica.
6708324	Did you understand what I said?	12713689	As comprés çò qu'ai dich ?
7521368	Everyone wanted to do this.	12713690	Tot lo monde voliá far aquò.
7521368	Everyone wanted to do this.	12713691	Tot lo monde o voliá far.
6355169	I won't do that with you.	12713693	Farai pas aquò amb tu.
1954802	We can't risk it.	12713695	Podèm pas riscar aquò.
1860405	Don't thank me yet.	12713697	Me merceges pas encara.
3439754	Tom is a kleptomaniac.	12713740	Tom es un cleptoman.
6728694	I couldn't have done that on my own.	12713959	O poiriá pas aver fach sol.
5737308	I found that very unnatural.	12714145	Trobèri aquò manierós.
248786	We lost the game.	12714168	Perdèrem la partida.
259705	I like to work.	5287693	M'agrada de trabalhar.
2377611	I like to work with Tom.	12714171	M'agrada de trabalhar amb Tom.
3903043	I like to work with him.	12714190	M'agrada de trabalhar amb el.
3903044	I like to work with her.	12714191	M'agrada de trabalhar amb ela.
2800750	I don't like to work.	12714192	M'agrada pas de trabalhar.
1987380	Drop the anchor!	12714541	Escampa lo fèrre !
4529754	That's an abuse of authority.	12715032	Es una forfachura.
4530062	It's an abuse of power.	12715034	Es un abús de poder.
7123051	That's an abuse of power.	12715034	Es un abús de poder.
10187967	This is yet another example of flagrant abuse of power.	12715233	Aquò es un exemple de mai de flagrant abús de poder.
3272413	The abuse of alcohol among young people is a serious problem.	12715234	L'abús d'alcoòl demest lo jovent es un problèma grèu.
5905550	The bench is wooden.	12717214	Lo banc es de fusta.
9977587	The ship is stranded on a sandbank.	12717216	Lo batèl s'encalèt sus un sablàs.
8078586	Tom is narcissistic.	12717407	Tom es narcissic.
11766936	Narcissistic individuals tend to exploit and manipulate others to achieve their goals.	12717408	Los individús narcissics an tendéncia a esplechar e manipular los autres per arribar a los objectius.
7489930	What's your zodiac sign?	12188822	Quin es ton signe del zodiac ?
6029576	The Scorpion is one of the signs of the zodiac.	12720314	L'escorpion es un dels signes del zodiac.
6876712	My sign of the Zodiac is Virgo. What's yours?	12720316	Mon signe del zodiac es Verge. Quin es lo teu ?
681046	The funeral was yesterday.	12720977	Las funeralhas èran ièr.
2645701	Was Tom at the funeral?	12720976	Tom èra a las funeralhas ?
7390915	He sipped his tea in silence.	12720993	Siropegèt son tè en silenci.
16899	You have a regular pulse.	12357868	Avètz un pols regular.
8400697	No regrets.	12721261	Cap de pentiment.
8384101	Full screen.	12721375	Ecran complèt.
8384101	Full screen.	12721376	Plen ecran.
433863	I'm full.	12721377	Soi plen.
2887914	Parking was full.	12721378	Lo parc d'estacionament èra complèt.
25508	I am incomplete.	12721379	Soi incomplèt.
4496786	It was incomplete.	12721381	Èra incomplèt.
4496772	This report is incomplete.	12721382	Aqueste rapòrt es incomplèt.
9360202	This list is incomplete.	12721384	Aquesta lista es incomplèta.
5738421	Could you be more concrete?	12721389	Pòdes èsser mai concrèt ?
5738421	Could you be more concrete?	12721390	Podètz èsser mai concrèts ?
5738421	Could you be more concrete?	12721391	Pòdes èsser mai concrèta ?
5738421	Could you be more concrete?	12721392	Podètz èsser mai concrètas ?
5098028	Rainwater is pure.	12721583	L'aiga de pluèja es pura.
3120878	Rejection hurts.	12721596	Lo regèt dòl.
11423809	I experienced rejection.	12721604	Coneguèri lo regèt.
11423810	He experienced rejection.	12721605	Coneguèt lo regèt.
11423811	She experienced rejection.	12721605	Coneguèt lo regèt.
12237366	Long live democracy!	12722907	Visca la democracia !
31784	I don't have enough RAM.	12723002	Ai pas pro de memòria viva.
11385357	The RAM in a computer is its random access memory.	12723021	La RAM dins un ordenador es sa memòria d'accès aleatòri.
2045829	You're a very handsome young man.	12726178	Siás un jovent plan elegant.
7532039	Scandalous!	12730816	Escandalós !
6273454	Tom is a tattoo artist.	12731787	Tom es tatoaire.
3826522	I'm a tattoo artist.	12731789	Soi tatoaire.
3826522	I'm a tattoo artist.	12731791	Soi tatoaira.
10209967	Ziri became a tattoo artist.	12731792	Ziri venguèt tatoaire.
12185226	Tom crushed the worm.	12732135	Tom espotiguèt lo vèrm.
6676370	I suspect that Tom will eventually do that.	12732147	Suspècti que Tom o farà finalament.
3259332	I am looking for a jewelry store.	12733676	Cèrqui una joielariá.
3836055	They share a love for music.	12741147	Partejan un amor per la musica.
11947804	I almost threw up.	12741148	Ai mancat rendre.
17491	You are in part responsible for it.	12742657	Siás en partida responsable d'aquò.
9972253	I think we should reduce our prices.	12742670	Pensi que deuriam reduire nòstres prèses.
269915	Practice what you preach.	12749294	Practica çò que predicas.
2730893	Heroin is a drug.	12305161	L'eroïna es una dròga.
3995846	Child, my name is Jesus and I'm your father.	12762373	Filh, m'apèli Jèsus e soi ton paire.
6581019	You have carte blanche, you can do what you want.	12777169	Avètz los quatre pès blanc, podètz far çò que volètz.
12016306	She's not my sister, she's my wife.	12778370	Es pas ma sòrre, es mon esposa.
12016306	She's not my sister, she's my wife.	12778371	Es pas ma sòrre, es ma molhèr.
10676108	It's the gospel truth.	12778383	Es la santa vertat.
896148	I bought fresh bread.	12779257	Ai crompat de pan tendre.
12729077	She's mute.	12366624	Ela es muda.
239261	Silk feels soft.	12780651	La seda es fòrça al tocar.
239261	Silk feels soft.	12780652	La seda es fòrça al palp.
239261	Silk feels soft.	12780653	La seda es fòrça al tòc.
7895857	Silk is expensive.	12780654	La seda es cara.
55920	This feels like silk.	12780655	Sembla seda.
2959289	Is this real silk?	12780656	Es de seda vertadièra ?
6145615	Those oracular Chinese proverbs were confusing for the students.	12783743	Aqueles provèrbis chineses profetics èran ambigús pels estudiants.
8268887	The satellite dish no longer works.	12787024	La parabòla fonciona pas mai.
10216443	Ziri was messing with the satellite dish.	12787029	Ziri chaupinava la parabòla.
7782514	Tom installed a satellite dish on his balcony.	12787030	Tom installèt una parabòla sus son balcon.
7782514	Tom installed a satellite dish on his balcony.	12787031	Tom installèt una antena parabolica sus son balcon.
8684710	There's a special compatibility program you can install to make the PlayStation VR work with your Windows computer.	12789665	I a un programa especial que pòdes installar per far foncionar la PlayStation VR amb vòstre ordenador Windows.
10042259	I don't know when the last time was that I updated Windows.	12789666	Sabi pas quora èra lo darrièr còp qu'actualizèri Windows.
6670799	Windows is updating.	12789667	Windows se met a jorn.
316731	She is an estate agent.	12800638	Es corratièra.
6179398	He is an estate agent.	12800642	Es corratièr.
9268898	That worried me.	12802694	Me fasiá taïnar.
9254364	It worries me.	12802692	Me fa taïnar.
9254364	It worries me.	12802699	Me fa tantainar.
37243	Tom doesn't like cheese.	12802718	A Tom li agrada pas lo formatge.
881859	Tom does not like cheese.	12802718	A Tom li agrada pas lo formatge.
416554	I ate the cheese.	12229851	Mangèri lo formatge.
10208190	Ziri was thirsty.	12804566	Ziri aviá set.
252624	I have breakfast at seven.	12804579	Dejuni a sèt oras.
12721053	Seven?	12804598	Sèt ?
6879992	Seven policemen died.	12804600	Sèt policièrs moriguèron.
11828452	I'm seven.	12804602	Ai sèt ans.
2638346	They had seven children.	12804609	Avián sèt enfants.
2698783	He has seven sons.	12804611	A sèt filhs.
2790520	She speaks seven languages.	12804613	Parla sèt lengas.
12061948	From figs and Swiss chard to edible nasturtiums, Finley grows fruits and vegetables that are rare in the inner city, where he says residents have better access to fast food and liquor stores than to healthful produce.	12805867	De las figas e de la bèla soïssa a las capuchinas comestiblas, Finley cultiva de fruchas e legums que son rars dins lo centre de la vila, ont ditz que los estatjants an un melhor accès a las botigas de restauracion rapida e de licor qu'als produches bons per la santat.
12808083	Anne lives in France.	12224887	Anaïs viu en França.
10625485	Generation Z has added a whole new dimension to the meanings of emojis.	12817188	La generacion Z apondèt una dimension complètament novèla a la significacion dels emojis.
282429	I have a urinary problem.	12821706	Ai un problèma urinari.
8100164	Leave him alone!	12823101	Daissa-lo estar !
5790191	It's in your bag.	12823536	Es dins ton sacon.
5790191	It's in your bag.	12823537	Es dins ta saqueta.
1272889	Be like me and have a glass of wine.	12823539	Fa coma ieu e pren un gòt de vin.
6258775	Tom is swimming with some friends.	12823540	Tom es a nadar amb d'amics.
3171312	Tom is deaf.	12366607	Tom es sord.
452808	The pie is delicious.	12823779	La tarta es deliciosa.
452808	The pie is delicious.	12823780	La crostada es deliciosa.
7856778	Algeria needs to consolidate its democracy.	12824797	L'Argeria deu consolidar sa democracia.
7856778	Algeria needs to consolidate its democracy.	12824798	L'Argeria deu assolidar sa democracia.
3260372	Niçoise salad is a typical food of the area near Nice.	12826016	La salada nissarda es un manjar tipic de la region de Niça.
12834868	Frugal but not stingy!	12834869	Frugal mas pas avar !
10701790	I think Boston is better than Chicago.	12837781	Pensi que Boston es melhor que Chicago.
2252590	The train left.	12837783	Lo tren partiguèt.
2252590	The train left.	12837784	Lo tren es partit.
9182416	This is white bread.	12837802	Aquò es de pan blanc.
7183591	Sami shouldn't panic.	12837808	Sami se deuriá pas desvariar.
6646910	Tom told me he thought Mary was insane.	12842282	Tom me diguèt que pensava que Mary èra fòla.
6646910	Tom told me he thought Mary was insane.	12842283	Tom me diguèt que pensava que Mary èra bauja.
319525	Please air the room.	12842290	Aireja la cramba se te plai.
319525	Please air the room.	12842291	Ventila la cramba se te plai.
11964467	Mum, my willy's all hard.	12844005	Mamà, ma quiqueta es tota dura.
307888	Do I know him?	12848609	Lo coneissi ?
4401028	Is this ethical?	12849728	Es etica ?
273362	The washing machine is a wonderful invention.	12852638	La maquina de lavar es una invencion meravilhosa.
7474860	They have to take their medication.	12852806	Lor cal prendre lor medicament.
7474860	They have to take their medication.	12852808	Lor cal prendre lor remèdi.
7474860	They have to take their medication.	12852809	Lor cal prendre lor repotinga.
8924905	I like cinnamon.	12857468	M'agrada la canèla.
3825728	Tom likes tea with cinnamon.	12857470	Li agrada a Tom lo tè amb canèla.
10085120	Your kisses taste like cinnamon.	12857473	Tos potons tastan coma la canèla
1890695	It went viral.	12857527	Venguèt viral.
5166588	I need more caffeine.	12857547	Ai mestièr de mai de cafeïna.
5964492	I love French fries.	12857562	M'agradan las fritas.
5964492	I love French fries.	12857563	Aimi las fritas.
482613	You disappointed me.	12859046	M'as decebut.
1676666	He led a vagabond life.	12859274	Mena una vida de vagabond.
1676666	He led a vagabond life.	12859275	Mena una vida de barrutlaire.
1835657	My brother wants to visit Liechtenstein.	12859379	Mon faire partiguèt visitar lo Liechtenstein.
2639400	Vaduz is the capital of Liechtenstein.	12859380	Vaduz es la capitala del Liechtenstein.
10730526	Liechtenstein is a constitutional monarchy.	12859382	Lo Liechtenstein es una monarquia constitucionala.
12847918	Always be candid.	12861094	Siás totjorn candid.
12847918	Always be candid.	12861095	Siás totjorn candida.
12847918	Always be candid.	12861096	Siás totjorn candide.
4494695	Tom is always candid.	12861097	Tom es totjorn candid.
4494695	Tom is always candid.	12861099	Tom es totjorn candide.
2647080	That was predictable.	12861117	Aquò èra previsible.
2905609	Guys are predictable.	12861122	Los dròlles son previsibles.
3821408	It was predictable.	12861119	Èra previsible.
3821410	You're predictable.	12861123	Siás previsible.
3821410	You're predictable.	12861124	Siás previsibla.
792399	You're so predictable.	12861126	Siás talament previsible.
11889598	Speak clearly and articulate your words.	12861141	Parla clar e articula.
11670917	I try to articulate words, but I can't speak.	12861143	Ensagi d'articular, mas pòdi pas parlar.
10856906	Try to amplify your opportunity.	12861156	Ensaja d'amplificar tas ocasions.
12113604	We need to amplify their voice.	12861158	Nos cal amplificar lor votz.
10102094	The signal is weak, so an amplifier is used.	12861162	Lo senhal es feble, donc cal un amplificador.
10070450	Germany and Norway on Thursday officially launched an undersea power cable between the two countries in a project that aids Europe’s effort to shift from fossil fuels to renewable energy.	12867751	Alemanha e Norvègia lancèron oficialament dijòus un cable electric sosmarin entre los dos païses per un projècte qu'ajuda dels esfòrces d'Euròpa a bascular de las energias fossilas a las renovablas.
1894560	It's time to party.	12870471	Es ora de festejar.
464246	To the swimming pool!	12780745	A la piscina !
12878309	She'll be arriving late.	12740875	Arribarà en retard.
9681207	These rocks are angular.	12879797	Aquestas ròcas son angulars.
9681207	These rocks are angular.	12879799	Aquestes ròcs son angulars.
5640449	I prefer working this way.	12880590	M'estimi mai trabalhar aital.
313842	She was born last year.	12881409	Nasquèt l'an passat.
25872	The monkeys are grooming each other.	12881413	Los monins se tiran las nièras.
11200946	Ziri redoes his bandage every time it gets wet.	12882135	Ziri refà son pensament.
4999984	It took us a while.	12882225	Nos prenguèt un moment.
8407366	You can learn French.	12882229	Pòdes aprendre lo francés.
11213755	I'll copy this quickly.	12882230	Copiarai aquò lèu.
5160682	Tom is looking for advice.	12882231	Tom vòl de conselhs.
5160682	Tom is looking for advice.	12882233	Tom cèrca de conselhs.
6273286	Tom said he's ticklish.	12882234	Tom diguèt qu'es cossergós.
6273286	Tom said he's ticklish.	12882236	Tom diguèt qu'es cotigós.
1744258	The plan is not yet finalized.	12882239	Lo plan es pas encara finalizat.
9773028	Don't forget to open the window.	12882537	Oblides pas de dobrir la fenèstra.
8398467	Tom wanted to learn to waltz.	12882540	Tom voliá aprendre a valsar.
12056612	It was like old times.	12882541	Èra coma los autres còps.
12343909	From time to time.	12883371	De temps en temps.
3605507	Well, from time to time.	12883372	E ben, de temps en temps.
1360047	We agree from time to time.	12883373	Sèm d'acòrdi de temps en temps.
8221550	Things change from time to time.	12883375	Las causas càmbian de temps en temps.
8221553	From time to time it happens.	12883376	De temps en temps arriba.
9838307	This happens from time to time.	12883377	Aquò arriba de temps en temps.
11780537	We talk from time to time.	12883386	Parlam de temps en temps.
11780537	We talk from time to time.	12883387	Charram de temps en temps.
258158	I meet him from time to time.	12883388	Lo vesi de temps en temps.
306761	They visit us from time to time.	12883389	Venon nos veire de temps en temps.
504591	We go fishing from time to time.	12229638	Anam pescar de temps en temps.
6263866	Tom does that from time to time.	12883392	Tom a fa de temps en temps.
6263866	Tom does that from time to time.	12883393	Tom fa aquò de temps en temps.
6700743	We visit him from time to time.	12883394	L'anam veire de temps en temps.
7820692	She visits me from time to time.	12883395	Me ven veire de temps en temps.
7872113	Tom visits me from time to time.	12883396	Tom me ven veire de temps en temps.
8221513	From time to time I go there.	12883402	De temps en temps vau ailà.
8221513	From time to time I go there.	12883404	De temps en temps vau alai.
10127899	I see Tom from time to time.	12883458	Vesi Tom de temps en temps.
38268	Please write to me from time to time.	12883459	Se te plai escriu-me de temps en temps.
2650834	I love hamburgers.	12883845	M'agradan los hamburgers.
453418	I ordered two hamburgers.	12883846	Ai comandat dos hamburgers.
2807630	I ate a hamburger.	12883847	Mangèri un hamburger.
3135784	I like sandwiches.	12883851	M'agradan los entrepans.
6842872	I forgot that Tom could speak French.	12884733	Oblidèri que Tom sabiá parlar francés.
8334452	What are you planning to do today?	12884735	Qu'as previst de far uèi ?
6268807	Tom should cancel his party.	12884736	Tom deuriá anullar sa fèsta.
11418109	She was unharmed.	12886745	Èra salva.
11418109	She was unharmed.	12886746	Èra indemna.
11418109	She was unharmed.	12886747	Èra escapa.
11710641	Lorenzo was unharmed.	12886749	Lorenzo èra salve.
11710641	Lorenzo was unharmed.	12886750	Lorenzo èra escap.
11710641	Lorenzo was unharmed.	12886751	Lorenzo èra indemne.
10903602	Martial law was declared.	12888590	La lei marciala foguèt declarada.
10903603	Martial law has been declared.	12888591	La lei marciala es estada declarada.
11880610	The president declared martial law.	12888592	Lo president declarèt la lei marciala.
12425911	Witchcraft exists everywhere, even in Finland.	12889393	La mascariá existís pertot, amai en Finlàndia.
2247188	Motion denied.	12890100	Mocion refuzada.
2247188	Motion denied.	12890101	Mocion regetada.
11943147	Do we have any vinegar left?	12581260	Avètz encara de vinagre ?
12894917	We were demanding.	12894912	Èrem exigents.
3778091	Is Tom left-handed or right-handed?	12896591	Tom es esquerrièr o drechièr ?
8458645	The dog's dead.	5685201	Lo can es mòrt.
2541283	I'm well aware of the situation.	5628025	Soi conscient de la situacion.
263601	I have to brush my teeth.	12923480	Me cal fretar las dents.
1394293	Tom has scurvy.	12925129	Tom a l'escorbut.
12925740	May I turn the radio on?	12925750	Pòdi alucar la ràdio ?
12927270	The cadence is fast.	12817794	La cadéncia es rapida.
7950086	Mary is a radical vegan.	12927440	La Maria es una vegana radicala.
6405368	Religion is a threat.	12571480	La religion es una menaça.
5416401	Who'd buy this?	12929987	Qual crompariá aquò ?
7736238	I can't let you in without a ticket.	12929989	Vos pòdi pas daissar dintrar sens tiquet.
7736238	I can't let you in without a ticket.	12929990	Vos pòdi pas daissar dintrar sens bilhet.
24342	The summer is over.	12929993	L’estiu es acabat.
2750770	I didn't tell him you were coming.	12929995	Li ai pas dich que veniás.
10091838	No, I didn't go to Torino.	12930877	Non, soi pas anat a Turin.
12934097	Tom will spend Christmas at work this year.	12934227	Tom passarà Nadal al trabalh ongan.
12934093	Do you want Tom to spend Christmas with us?	12934228	Vòles que Tom passe Nadal amb nosautres ?
12934093	Do you want Tom to spend Christmas with us?	12934229	Vòls que Tom passe Nadal amb nosautres ?
12934091	How many Christmas presents did you get?	12934230	Quantes de presents de Nadal as agut ?
12933272	Somebody stole the Christmas tree from Tom.	12934231	Qualqu'un a panat l'arbre de Nadal de Tom.
7857745	Where's the marketplace?	12936895	Ont es la plaça de mercat ?
10691491	The wine is in the marketplace.	12936897	Lo vin es sul mercat.
3731404	Please tell me where the marketplace is.	12936898	Mercés de me dire ont se tròba la plaça de mercat.
12119351	It's not far from the marketplace.	12936899	Es pas luènh de la plaça de mercat.
12119351	It's not far from the marketplace.	12936900	Es pas lonh de la plaça de mercat.
12119351	It's not far from the marketplace.	12936903	Es pas luònh de la plaça de mercat.
12131909	The table of contents is at the end of the book.	12943355	L'ensenhador es a la fin del libre.
7748764	The table of contents is in Berber.	12943360	L'ensenhador es en berbèr.
8983254	That color sequin is too ugly for my dress.	12943804	Aqueste sequin de color es tròp laid per ma rauba.
12079733	Her black dress was adorned with sequins.	12943813	Sa rauba negra èra ornada de sequins.
12079733	Her black dress was adorned with sequins.	12943815	Sa rauba negra èra ondrada de sequins.
10030491	Yanni lives there.	12948920	Y'a ni demorèt alai.
10030491	Yanni lives there.	12948921	Y'a ni demorèt ailà.
2453774	The funeral is tomorrow.	12720975	Las funeralhas auràn luòc deman.
12723076	Tom was a complaisant child.	12967369	Tom èra un dròlle complasent.
12723082	Tom is a complaisant husband.	12967381	Tom es un espós complasent.
12723082	Tom is a complaisant husband.	12967382	Tom es un marit complasent.
